{
  "schema_version": "contextsafe.case/0.1.0",
  "case_id": "CTP-I01",
  "synthetic_identifier": {
    "system": "urn:contextsafe:synthetic",
    "value": "CSYN-CTP-I01"
  },
  "concepts": {
    "gender_identity": {
      "status": "specified",
      "value": "fixture-gender-1",
      "code_system": "urn:contextsafe:fixture"
    },
    "recorded_sex_or_gender": [
      {
        "value": "X",
        "context": "government-id",
        "source": "synthetic-fixture"
      }
    ],
    "sex_parameter_for_clinical_use": [
      {
        "value": "fixture-context-1",
        "context_id": "ORDER-CSYN-I01-A",
        "supporting_observation_ids": ["SUP-CSYN-I01-A"]
      }
    ],
    "name_to_use": {
      "status": "specified",
      "value": "CSYN-ASTER",
      "use": "usual"
    },
    "pronouns": {
      "status": "specified",
      "value": "they/them"
    }
  },
  "prohibited_inferences": [
    "gender_identity_to_spcu",
    "recorded_sex_or_gender_to_spcu"
  ]
}
